{
  "$schema": "../../../schemas/multilingual_benchmark_manifest_v1.schema.json",
  "schema_version": "multilingual_benchmark_manifest_v1",
  "artifact_version": "mit_60001_multilingual_m1_v1",
  "status": "frozen",
  "m1_gate_status": "passed",
  "number_of_intents": 20,
  "source": {
    "benchmark_questions_path": "evaluation/mit_60001/evaluation_questions.jsonl",
    "source_benchmark_hash": "81d5a1374118b01d850d7c4808edf89b9432036a4488c49f5150720aa3fc8dee",
    "benchmark_manifest_path": "evaluation/mit_60001/benchmark_manifest.json",
    "benchmark_manifest_sha256": "75e4c1b6296c27a5485be0034d5d8425ad9966efb7be2152a741ff2d349f7724",
    "canonical_gold_path": "data/gold/mit_60001/chunks.jsonl",
    "canonical_gold_sha256": "c03abf002c29b784d191eb393670da27b80fed8e0e18798f113d7ff8b7daf432",
    "silver_path": "data/silver/mit_60001/transcripts_clean.jsonl",
    "silver_sha256": "50d559529bedc33715b13312c5e4b7def80ac808521b53699a14465e084a8ecb",
    "ground_truth_policy": "copy canonical ranges unchanged and map relevant chunks by same-video source-segment interval intersection"
  },
  "selection": {
    "method": "purposeful coverage selection from canonical approved-answerable questions; no random sampling",
    "selected_question_ids": [
      "mit60001-q-001",
      "mit60001-q-002",
      "mit60001-q-003",
      "mit60001-q-004",
      "mit60001-q-005",
      "mit60001-q-006",
      "mit60001-q-008",
      "mit60001-q-010",
      "mit60001-q-014",
      "mit60001-q-016",
      "mit60001-q-020",
      "mit60001-q-021",
      "mit60001-q-022",
      "mit60001-q-023",
      "mit60001-q-025",
      "mit60001-q-029",
      "mit60001-q-033",
      "mit60001-q-034",
      "mit60001-q-037",
      "mit60001-q-039"
    ],
    "intent_type_counts": {
      "comparison": 5,
      "concept_relationship": 4,
      "how": 3,
      "multi_point": 2,
      "procedure": 2,
      "what": 1,
      "why": 3
    },
    "evidence_shape_counts": {
      "multiple_chunks": 16,
      "single_chunk": 4
    },
    "single_ground_truth_range_count": 10,
    "multiple_ground_truth_ranges_count": 10
  },
  "translation": {
    "translation_method": "ollama_local_literal_translation",
    "question_vi_authoring_method": "codex_draft_from_canonical_english_pending_human_review",
    "translation_input_fields": [
      "question_vi"
    ],
    "forbidden_input_fields": [
      "question_en",
      "ground_truth_ranges",
      "expected_answer_points",
      "relevant_chunk_ids",
      "retrieved_evidence",
      "answer_labels"
    ],
    "provider": "Ollama local",
    "provider_version": "0.32.15",
    "model": "llama3.2:3b",
    "model_digest": "a80c4f17acd55265feec403c7aef86be0c25983ab279d83f3bcd3abbcb5b8b72",
    "system_prompt_sha256": "31bf7a4bf6a61a02936fbb066944d0508ece5aadbb9391848b7dd3fe163d6177",
    "generation_parameters": {
      "temperature": 0,
      "seed": 42,
      "num_predict": 128,
      "num_ctx": 4096
    }
  },
  "artifacts": {
    "paired_artifact": {
      "path": "evaluation/mit_60001/multilingual/paired_intents_v1.jsonl",
      "sha256": "c416752a7bc83d956f8a95990bfb8ad0d40cd6ac905498bd656c6309b05c43da"
    },
    "paired_schema": {
      "path": "schemas/multilingual_paired_intent_v1.schema.json",
      "sha256": "cc86eeb1c4598f79a8bd6de47331cf250bdd5f45dc12aa3a1d7614a1dbe70695"
    },
    "translation_generation_log": {
      "path": "evaluation/mit_60001/multilingual/translation_generation_v1.jsonl",
      "sha256": "5b740e81050ba3a2bd24e6a553b582bb04940f4237b4238e919a58de6b4a245d"
    },
    "translation_revision_log": {
      "path": "evaluation/mit_60001/multilingual/translation_revision_log_v1.jsonl",
      "sha256": "475e8b5fdcdcf2057552daa185236b2d558519367087a7791f68f41fd4d0990f"
    },
    "human_review": {
      "path": "evaluation/review/multilingual/mit_60001_multilingual_m1_human_review.csv",
      "sha256": "7056842accaf31aa7d364ff8370eff61da1caf3b73680d215b0ab57a3ce7fcae"
    },
    "human_review_source": {
      "path": "evaluation/review/multilingual/mit_60001_multilingual_m1_human_review_reviewed_by_user.csv",
      "sha256": "e22a0439f0940c78184772b0c559baefe976497e4797ffcc40ac871b5a6dabca"
    }
  },
  "review": {
    "allowed_labels": [
      "Equivalent",
      "Minor wording difference",
      "Semantic drift"
    ],
    "completed_count": 20,
    "pending_count": 0,
    "semantic_drift_count": 0,
    "review_status_counts": {
      "Equivalent": 19,
      "Minor wording difference": 1
    },
    "reviewer_counts": {
      "Võ Trí Đạt": 20
    }
  },
  "validation_status": "passed"
}
